case_id,name_zh,name_en,period,actor,conflict_context,target_or_platform,decoy_form,mobility,spectral_features,deception_effect,source_quality,source_refs,notes
HIST-1944-FORTITUDE,坚忍行动南方,Operation Fortitude South,1944,Allied forces / FUSAG,Second World War / Normandy landings,"Invasion force, landing craft, armor, aircraft, unit presence","Physical decoys plus radio and double-agent deception",Static / relocatable,"Optical, radio traffic, human-source narrative","Misled German command about invasion location and timing; reinforced Pas-de-Calais expectation",A,"IWM-FORTITUDE; ENGLISH-HERITAGE-FORTITUDE; AUP-FORTRESS-EUROPE","Canonical example of decoys supporting a broader deception story rather than acting alone."
HIST-1991-DESERT-STORM,沙漠风暴欺骗行动,Desert Storm deception,1990-1991,"U.S.-led coalition",Operation Desert Shield / Desert Storm,"Coalition main effort, amphibious threat, ground maneuver plan","Operational deception, demonstrations, feints, emissions and posture management",Static / maneuver-integrated,"Optical posture, radio/signals, movement pattern","Fixed Iraqi attention toward Kuwait and the coast while coalition ground maneuver developed elsewhere",A,"AUP-DECEPTION-DESERT; CGSC-DESERT-STORM-DECEPTION","Useful for studying decoys as part of campaign design."
HIST-1991-SCUD-HUNT,沙漠风暴飞毛腿搜猎,Operation Desert Storm Scud hunt,1991,Iraq / coalition ISR-strike forces,Gulf War,"Mobile Scud TELs and similar-looking vehicles","Mobility, concealment, possible decoys and look-alike vehicles",Mobile,"Optical, mobility pattern, launcher signature ambiguity","Consumed large ISR, SOF, and air effort; many reported kills were hard to validate",B,"SOFNEWS-SCUD-HUNT; NGWRC-SCUD; JSTOR-SCUD-HUNT","Treat as a targeting-ambiguity case; individual decoy claims require corroboration."
HIST-1999-KOSOVO,科索沃空袭假目标,Kosovo / Operation Allied Force decoys,1999,Federal Republic of Yugoslavia / Serbian forces,NATO Operation Allied Force,"Tanks, artillery, fielded forces, IADS elements","Camouflage, mockups, decoys, emission discipline, shoot-and-scoot tactics",Static / mobile / relocatable,"Optical, thermal cues, radar emission control, pattern-of-life denial","Preserved some forces and complicated NATO BDA and target validation",A/B,"RAND-KOSOVO; NDU-KOSOVO-FIELDED-FORCES; AFMC-SERBIAN-IADS; PARAMETERS-KOSOVO-INFO-SUPERIORITY","Strong case for countering airpower with deception plus disciplined emissions."
MOD-2022-INFLATECH-UKRAINE,俄乌战场充气假目标,Russia-Ukraine inflatable decoys,2022-present,Ukraine / Russia / Inflatech and other suppliers,Russia-Ukraine war,"Tanks, artillery, aircraft, HIMARS-like systems, radars, vehicles",Inflatable and physical decoys,Relocatable,"Optical, thermal and radar claims vary by vendor/model","Draws reconnaissance and strike attention; supports cost-imposition against precision weapons",B,"AP-INFLATECH; RFERL-INFLATECH; FORBES-DECOY-TANKS; INFLATECH-HOME","Keep vendor performance claims separate from verified battlefield effects."
MOD-2023-RUSSIAN-DECOY-UNITS,俄军充气装备与伪装工程分队,Russian inflatable decoy units in Ukraine,2022-present,Russian forces / camouflage engineer units,Russia-Ukraine war,"T-72-like tanks, radars, missile systems, aircraft-like targets","Inflatable and physical decoys",Relocatable,"Optical, possible thermal/radar augmentation","Creates false target density and complicates drone-observed BDA",B/C,"NEWSWEEK-RUSSIAN-INFLATABLE; 1945-RUSSIA-INFLATABLE","Open-source imagery claims should be treated as provisional unless geolocated and corroborated."
MOD-2024-US-ARMY-EXERCISE,美军演训中的充气目标与假电台,Inflatable decoys and fake radio signals in U.S. Army exercise,2024,U.S. Army / 10th Mountain Division exercise,Training / tactical deception,"Artillery or command-post-like target signatures","Inflatable decoys plus faked radio signals",Relocatable,"Optical, electromagnetic","Baited opposing-force fires and exposed enemy artillery in exercise context",B,"TWZ-US-ARMY-DECOYS; WARROOM-EM-DECOYS","Useful bridge between doctrine discussion and field experimentation."
MOD-2025-RU-UA-DECOY-TANKS,俄乌高级假坦克竞赛,Russia-Ukraine advanced decoy tanks,2025,Ukraine and Russia,Russia-Ukraine war,"Main battle tanks and armored vehicles","Improved inflatable/physical decoys",Relocatable,"Optical, thermal, radar-related claims","Arms race in decoy realism under drone surveillance and precision strike",B,"FORBES-DECOY-TANKS; NV-UA-DECOY-ARMS-RACE","Good case for tracking adaptation loops between decoy makers and ISR operators."
IND-SEA-WOLF-F35,Sea Wolf F-35 充气诱饵,Sea Wolf Global F-35 decoy,2020s,Sea Wolf Global / Seawolf Marine,Industry / airbase survivability,"F-35 aircraft on ground","Inflatable aircraft decoy",Relocatable,"Optical, thermal/IR, radar reflector categories, wireless-control claims","Creates false aircraft targets at airfields or dispersed operating sites",A/B,"SEAWOLF-F35; INTERESTING-ENGINEERING-F35; DEFENSE-REDEFINED-F35; SANDBOXX-F35","Vendor page is primary for product claims; media adds deployment-time and cost context."
IND-TEMERLAND-LEOPARD,Temerland 主动豹式坦克假目标,Temerland active Leopard tank decoy,2020s,Temerland,Industry / Russia-Ukraine-inspired concept,Leopard tank,"Vehicle-based active dummy / mobile decoy",Remote-controlled / mobile,"Optical, behavior, possible thermal/mechanical cues","Adds movement and behavior to increase target credibility",A/B,"TEMERLAND-LEOPARD; EUROMAIDAN-TEMERLAND","Useful active-decoy concept; independent effectiveness remains unverified."
CONCEPT-EM-DECOYS,电磁诱饵与假指挥节点,Electromagnetic decoys and false C2 nodes,2020s,U.S. Army / Marine Corps concepts,Modern multi-domain operations,"Command posts, formations, radars, C2 nodes","Electromagnetic decoy, false emission, signature management",Static / mobile / air-dropped concepts,"RF, radio traffic, radar/EMS signatures","Confuses targeting, causes wasted fires, masks real formations, supports feints",A/B,"WARROOM-EM-DECOYS; WOTR-EMS-DECEPTION; DEFENSESCOOP-EMS-DECOY","Most useful as concept and requirements input rather than a single hardware case."
AIRBASE-ACE,敏捷战斗运用与机场生存力,Agile Combat Employment and airbase survivability,2020s,U.S. Air Force / RAND / CRS,Airbase survivability under precision strike,"Aircraft, airbases, dispersal sites, sustainment nodes","Dispersal plus passive defense and deception",Distributed / relocatable,"Optical, thermal, pattern-of-life, force posture","Complicates adversary find-fix-track-target-engage-assess cycle",A,"USAF-ACE; RAND-AIRBASE-ATTACKS; CRS-ACE; AIR-UNIVERSITY-ACE","Operational context for autonomous aircraft decoys and false airbase signatures."
IND-INFLATECH-CATALOG,INFLATECH 充气军事假目标,INFLATECH inflatable military decoys,2020s,INFLATECH / NorseStorm distribution,Industry / modern conflict demand,"Tanks, launchers, radars, aircraft, trucks, artillery","Inflatable decoys",Relocatable,"Optical, thermal and radar claims by product family","Provides scalable false target inventory for training and combat deception",A/B,"INFLATECH-HOME; INFLATECH-NEWS; NORSESTORM-INFLATABLE; AP-INFLATECH","Good taxonomy source for product categories."
CONCEPT-REPLICATOR,可消耗自主系统规模化,Replicator and attritable autonomous systems,2023-present,U.S. Department of Defense / DIU,U.S. autonomy and mass initiative,"All-domain attritable autonomous systems","Autonomous attritable systems; not necessarily decoys",Mobile / autonomous,"Autonomy, coordination, distributed behavior","Strategic context for low-cost mass and expendable platforms that can include decoy functions",A,"DIU-REPLICATOR; DIU-REPLICATOR-SOFTWARE","Use as adjacent concept, not proof of any specific decoy program."
MOD-2020-NK-AN2,纳卡战争 An-2 诱饵无人机压制防空,Nagorno-Karabakh An-2 bait-drone SEAD,2020,Azerbaijan,Second Nagorno-Karabakh War,"Armenian air defenses (SAMs, radars); decoy imitates a manned strike aircraft",Physical/behavioral decoy (Soviet-era An-2 converted to expendable drone),Autonomous / one-way,"Optical, radar return of a large slow aircraft, flight behavior","Baited Armenian air-defense radars and launchers into activating and firing, exposing their positions for Bayraktar TB2 and loitering-munition (Harop) strikes; SEAD by decoy",A/B,ARMY-NK2020-LESSONS; RAF-ASPR-NK-DRONES; BAS-AN2-CROPDUSTER; SWJ-NK-LESSONS,"Flagship modern case of an attritable decoy used for suppression of enemy air defenses; the SEAD effect is widely reported, but individual loss and kill tallies vary by source."
MOD-2022-UA-HIMARS-DECOY,乌克兰假 HIMARS 诱骗俄军巡航导弹,Ukrainian decoy HIMARS luring Russian cruise missiles,2022-present,Ukraine (Metinvest and other firms/volunteers),Russia-Ukraine war,"HIMARS/M270-like launchers, M777 howitzers, Sentinel-type radars; protects real launchers","Physical decoys: early wooden mockups, later higher-fidelity replicas; 250+ mock-ups reported",Relocatable,Optical (UAV/satellite); reported thermal/radar augmentation on later models,Drew repeated Russian Kalibr and Iskander strikes onto worthless targets; cost-imposition on scarce precision missiles; reportedly ~10 Kalibr drawn in the early episode,B,WAPO-UA-HIMARS-DECOY; UP-KALIBR-VS-HIMARS; EUROMAIDAN-MASTERS-ILLUSION; ARMYRECOG-FORTITUDE,"Specific HIMARS-baiting episode, distinct from the general inflatable-decoy case (MOD-2022-INFLATECH-UKRAINE); strike and expenditure counts are reported, not independently verified."
MOD-2023-RU-AIR-DECOY,俄军空中与机场假目标,Russian aerial and airbase decoys,2022-present,Russian forces,Russia-Ukraine war,"Ukrainian air defense and one-way attack drones; painted bomber silhouettes, inert cruise missiles, decoy balloons, inflatable command posts","Mixed: EO/signal decoys, inert munitions as decoys, painted silhouettes, inflatable C2",Static / air-launched,"Optical (painted Tu-95 silhouettes at Engels), EO/radar of balloons, inert missile and drone signatures","Diverts Ukrainian air defense and OWA drones, complicates SAR/EO BDA, and baits expensive air-defense missiles",A/B,USNI-DECOY-WARFARE-UKRAINE,Several distinct Russian techniques grouped here; painted-bomber and decoy-balloon claims rest largely on satellite imagery and a single analytic article.
MOD-2024-IL-IR-TRUEPROMISE,以伊直接对攻：真实承诺 I/II,Iran-Israel direct strikes (True Promise I and II),2024,Iran vs Israel (with US and allied defense),"Iran-Israel conflict, April and October 2024",Israeli air bases and air defense; the saturation salvo itself decoys defensive tracking and prioritization,Signal/saturation: mixed drone + cruise + ballistic salvos that decoy defensive tracking and interceptor allocation,N/A (munition salvo),"Multiple simultaneous radar tracks, mixed threat types, compressed timing","Mixed and large salvos stress radar processing and interceptor prioritization; the April 2024 intercept effort reportedly cost the defender ~US$1B, an unfavorable cost-exchange",A/B,FPRI-SHALLOW-RAMPARTS; SATURATION-LAYERED-BATTLEFIELD,"Here the 'decoy' is signal-level (saturation and mixed salvos) rather than physical dummies; impact counts (~9 after TP I, ~44-45 after TP II) follow FPRI and vary by source."
MOD-2025-IL-IR-12DAY,2025 年 6 月以伊十二日战争（崛起雄狮 / 真实承诺 III）,June 2025 Israel-Iran war (Rising Lion / True Promise III),2025,Israel and US vs Iran,"Twelve-day Israel-Iran war, June 2025; US strikes on Fordow, Natanz, Isfahan","Israeli air bases and cities; US/Israeli BMD (Arrow, David's Sling, THAAD, SM-3, Patriot)","Signal/saturation plus penetration aids: MRBM saturation, mixed salvos, maneuvering and cluster/submunition warheads",N/A (munition salvo),"Radar tracks, high-altitude submunition dispersal, maneuvering re-entry vehicles",Saturation and penaids degrade tracking fidelity and deplete high-cost interceptor magazines (Arrow stocks reported heavily drawn down); some leakers reach targets,A/B,FPRI-SHALLOW-RAMPARTS; TWZ-IRAN-CLUSTER-WARHEAD; DSA-IRAN-SATURATION,Covers the US-Israel-Iran triangle. Penaid and cluster-warhead observations are reported or imagery-based; interception and depletion percentages vary widely by source.
MOD-2023-HOUTHI-REDSEA,胡塞武装红海低成本消耗作战,Houthi Red Sea cost-exchange campaign,2023-present,Houthis (Iran-backed) vs US/UK/coalition naval forces,"Red Sea and Gulf of Aden, since Oct-Nov 2023",Commercial and naval shipping; coalition air and missile defenses; shore-based mobile launchers and decoy systems,Cost-imposition via cheap one-way drones and missiles; ground decoys and mobile launchers complicate counter-targeting,Mobile / one-way,"Mixed cruise, ballistic, and OWA-drone signatures; salvo timing","Cheap (~US$2k-40k) munitions force multimillion-dollar interceptor use; mobile launchers and decoys frustrate US/coalition strikes (Prosperity Guardian, Rough Rider)",B,NEWLINES-HOUTHI-DRONES; NATIONAL-CHEAP-DRONES; GEOPOL-DRONES-DOLLARS; NBC-HOUTHI-DRONES,"Core cost-exchange and asymmetry case; per-engagement cost figures are widely reported estimates, and the Houthi ground-decoy claim rests on Pentagon-assessment reporting."
CONCEPT-2026-LUCAS-EPICFURY,美军 LUCAS 低成本诱饵蜂群（坚定狂怒行动）,US LUCAS low-cost decoy swarm (Operation Epic Fury),2026,US Central Command,"Reported US operations against Iranian air defenses, 2026",Iranian air-defense network; massed low-cost decoys to open windows for follow-on strikes,Massed attritable decoy drones (LUCAS) used offensively to saturate and expose defenses,Autonomous / mass-launched,Air-vehicle radar and EO signatures presented in volume,"Inverts the Red Sea cost equation: cheap US decoys impose cost on, and create gaps in, Iranian point defenses for follow-on manned aircraft and cruise missiles",C,DEFENSEINFO-EPICFURY-LUCAS,"Recent, single-outlet, post-2025 reporting; treat as provisional until corroborated. Mirrors the Nagorno-Karabakh SEAD-by-decoy logic at scale, with roles reversed."
HIST-1982-BEKAA,贝卡谷地战役（鼹鼠蟋蟀 19 行动）,Bekaa Valley / Operation Mole Cricket 19,1982,Israel (IAF),1982 Lebanon War; SEAD campaign vs Syrian SAMs,Syrian SA-2/3/6 batteries and radars; decoys imitate strike aircraft,"Signal/physical decoys (Samson glide decoys, the TALD precursor) cued by Mastiff/Scout UAVs",Air-launched / one-way,Radar returns mimicking aircraft; UAV-cued ELINT and geolocation,"Baited Syrian SAM radars into emitting and launching, exposing them for anti-radiation and artillery fires; about 29 of 30 batteries destroyed; first Western destruction of a Soviet-built SAM network",A/B,FAS-TALD; WIKI-MOLE-CRICKET-19,"Historical anchor for decoy-enabled SEAD, predating the Nagorno-Karabakh An-2 case; battery and loss figures vary by source."
SIG-CHAFF-FLARE,箔条与红外诱饵弹（消耗式自卫诱饵）,Chaff and infrared decoy flares,1943-present,Multiple (orig. UK 'Window'; US/NATO/global),Air and naval self-protection since WWII,Radar- and IR-guided missiles; protects aircraft and ships,"Expendable signal decoys: chaff (RF) and flares (IR), dispensed by AN/ALE-47 and similar",Expendable / dispensed,"RF (chaff clutter and false returns); IR (high-temperature, multispectral, kinematic flares)","Break or seduce a missile's lock; modern multispectral/kinematic flares counter imaging-IR seekers, while chaff against pulse-Doppler radar is degraded by Doppler discrimination",B,GS-FLARES; WIKI-CHAFF; MM-COUNTERMEASURES,Foundational expendables; the chaff-vs-Doppler and flare-vs-imaging-IR arms race is a core counter-decoy thread (branch on counter-decoy).
SIG-ADM141-TALD,ADM-141 TALD/ITALD 战术空射诱饵,ADM-141 TALD / ITALD tactical air-launched decoy,1980s-present,"US Navy / Israel (Brunswick, IMI)",SEAD; origin 'Samson' (Bekaa 1982); used in Desert Storm 1991,Enemy IADS radars; mimics strike-aircraft radar cross-section,"Air-launched glide (TALD) and turbojet-powered (ITALD) decoy; chaff, passive (Luneburg lens) and active RF variants","Air-launched, preprogrammed glide or powered","Radar (Luneburg-lens passive, RF active), chaff; programmable flight profile",Saturates and dilutes IADS and baits radars to emit; more than 100 launched in the Desert Storm opening,A/B,FAS-TALD; DSN-TALD,Lineage: Samson -> TALD -> DARPA MALD -> ADM-160; the historical bridge to MALD. (1950s-60s ADM-20 Quail was the earlier B-52-carried decoy.)
SIG-ADM160-MALD,ADM-160 MALD/MALD-J 微型空射诱饵,ADM-160 MALD / MALD-J miniature air-launched decoy,2009-present,US Air Force / US Navy / Ukraine (Raytheon),SEAD; combat use reported in the Russo-Ukrainian war,Enemy early-warning and tracking radars; mimics aircraft RCS,Expendable turbojet decoy (ADM-160B) and jammer/decoy (ADM-160C MALD-J); MALD-X and Navy MALD-N derivatives,"Air-launched, GPS/INS, ~500+ nmi, programmable",Radar RCS emulation; active jamming (MALD-J); networking/swarming (MALD-X),"Dilutes and confuses IADS, provides stand-in jamming, and cues or exposes defenses for the strike package",A/B,ASF-MALD; DSN-MALD; GS-MALD,Active variants ADM-160B (decoy) and ADM-160C (MALD-J). Ukraine has employed MALD; procurement totals and variant status evolve.
SIG-ALE-TOWED,AN/ALE-50 与 AN/ALE-55 拖曳式诱饵,AN/ALE-50 and AN/ALE-55 towed decoys,1990s-present,US (Raytheon ALE-50; BAE ALE-55),Aircraft self-protection; ALE-50 combat use over Kosovo and Iraq,Radar-guided air-to-air and surface-to-air missiles; protects the host aircraft,"Towed RF decoy (ALE-50 'Little Buddy') and fiber-optic towed decoy (ALE-55, IDECM with ALQ-214)",Towed behind the aircraft,RF; ALE-55 repeats and amplifies aircraft-correlated jamming over a fiber-optic link,Seduces the missile lock off-board onto the towed body; ALE-55 covers 1-35 GHz on the B-1B and F/A-18E/F,A/B,WIKI-ALE50; WIKI-ALE55,"ALE-50 ~US$32k each, combat-proven; ALE-55 over 3,800 produced and in service."
SIG-NULKA,Nulka（MK 53）有源悬停舰载诱饵,Nulka MK 53 active expendable hovering decoy,1990s-present,"Australia / US (BAE Systems Australia, L3Harris/Lockheed)","Naval anti-ship-missile self-defense; US/AUS/CAN/USCG, 150+ ships",RF-guided anti-ship missiles; protects warships,Rocket-propelled hovering active RF decoy (offboard active expendable),"Launched, thrust-vectored hover, preprogrammed flight",RF; radiates a large false ship-like return that walks the seeker off the ship,Seduces the ASM seeker to an offboard hovering point; effective 360 degrees and independent of ship maneuver,A,NAVY-NULKA-MK53; BAE-NULKA; DST-NULKA,Australia's most successful defence export; the canonical 'active expendable decoy.'
SIG-NIXIE,AN/SLQ-25 Nixie 拖曳式鱼雷声诱饵,AN/SLQ-25 Nixie towed torpedo decoy,1970s-present,US Navy and allies (Ultra and others),Surface-ship torpedo defense (soft kill),"Acoustic-, wake-, and wire-guided torpedoes; protects surface ships",Towed electro-acoustic decoy (TB-14A body plus shipboard signal generator),"Towed astern, often in pairs",Acoustic; emits simulated ship noise (passive) and amplifies and returns active sonar pings,Draws torpedoes away from the ship onto the towed body; SLQ-25B/C/E add active-homing defeat and littoral tow,A/B,FAS-NIXIE; WIKI-NIXIE,Acoustic-domain analogue to RF towed decoys; the lightweight SLQ-61 (LWT) is the successor class.
SIG-ICBM-PENAIDS,洲际导弹突防诱饵与中段鉴别难题,ICBM penetration aids and the midcourse discrimination problem,1950s-present,"US, USSR/Russia, China and others",Strategic nuclear penetration vs ballistic missile defense,Missile-defense radars and interceptors; decoys accompany or disguise the reentry vehicle,"Signal/physical penaids: balloon decoys, chaff, replica RVs, IR-signature cooling, anti-simulation, jammers",Released in midcourse (exo-atmospheric),"Radar RCS-matched balloons, chaff clutter, IR-signature masking; anti-simulation makes the RV look like a decoy",Forces the defense to expend interceptors on false targets; the unsolved midcourse discrimination problem (LRDR and NGI aim to address it),A,CSIS-PENAIDS; GS-MIDCOURSE,Strategic-scale decoying; directly motivates the counter-decoy/discrimination branch. National penaid specifics are largely classified; cited works are open assessments.
